{
  "schemaVersion": "phase10n3.experimental_xrd_resource.v1",
  "resourceId": "phase13_demo3_experimental_xrd",
  "resourceVersion": "1",
  "resourceHash": "d1d92f1477ea8dc28cacf8d793622c2b978463f9cbcb5cc94d975247d2ba4406",
  "xAxis": {
    "kind": "two_theta",
    "unit": "degree"
  },
  "twoTheta": [
    19.8,
    20.0,
    20.2,
    39.8,
    40.0,
    40.2,
    59.8,
    60.0,
    60.2
  ],
  "intensity": [
    0.0,
    10.0,
    0.0,
    0.0,
    8.0,
    0.0,
    0.0,
    6.0,
    0.0
  ],
  "intensitySemantic": "counts",
  "wavelength": {
    "value": 1.54184,
    "unit": "angstrom"
  },
  "metadata": {
    "fixtureStatus": "SYNTHETIC_CONTROLLED",
    "purpose": "Phase 13 Demo 3 user-entry fixture; not an independent scientific reference"
  }
}
